<?xml version="1.0" encoding="UTF-8"?>
<Candy xmlns="CandyNS"
       xmlns:xsi="http://www.w3.org/2001/XMLSchema-instance"
       xsi:schemaLocation="CandyNS Candies.xsd">
    <candies>
        <candy id="kor0">
            <Name>Korovka2</Name>
            <Energy>20</Energy>
            <Type>
                <Caramel>true</Caramel>
                <Filling>true</Filling>
                <Chocolate>false</Chocolate>
            </Type>
            <Ingredients>
                <Water>100</Water>
                <Sugar>50</Sugar>
                <Fructose>50</Fructose>
                <Vanillin>20</Vanillin>
            </Ingredients>
            <Value>
                <Protein>2</Protein>
                <Fats>5</Fats>
                <Carbohydrates>20</Carbohydrates>
            </Value>
            <Production>Roshen</Production>
        </candy>
        <candy id="kor1">
            <Name>Korovka1</Name>
            <Energy>1</Energy>
            <Type>
                <Caramel>true</Caramel>
                <Filling>true</Filling>
                <Chocolate>false</Chocolate>
            </Type>
            <Ingredients>
                <Water>100</Water>
                <Sugar>50</Sugar>
                <Fructose>50</Fructose>
                <Vanillin>20</Vanillin>
            </Ingredients>
            <Value>
                <Protein>2</Protein>
                <Fats>5</Fats>
                <Carbohydrates>20</Carbohydrates>
            </Value>
            <Production>Roshen</Production>
        </candy>
        <candy id="kor">
            <Name>Korovka</Name>
            <Energy>10</Energy>
            <Type>
                <Caramel>true</Caramel>
                <Filling>true</Filling>
                <Chocolate>false</Chocolate>
            </Type>
            <Ingredients>
                <Water>100</Water>
                <Sugar>50</Sugar>
                <Fructose>50</Fructose>
                <Vanillin>20</Vanillin>
            </Ingredients>
            <Value>
                <Protein>2</Protein>
                <Fats>5</Fats>
                <Carbohydrates>20</Carbohydrates>
            </Value>
            <Production>Roshen</Production>
        </candy>
        <candy id="nuts">
            <Name>CandyNuts</Name>
            <Energy>8</Energy>
            <Type>
                <Caramel>true</Caramel>
                <Filling>true</Filling>
                <Chocolate>true</Chocolate>
            </Type>
            <Ingredients>
                <Water>80</Water>
                <Sugar>60</Sugar>
                <Fructose>80</Fructose>
                <Vanillin>40</Vanillin>
            </Ingredients>
            <Value>
                <Protein>5</Protein>
                <Fats>9</Fats>
                <Carbohydrates>40</Carbohydrates>
            </Value>
            <Production>Roshen</Production>
        </candy>
    </candies>
</Candy>